{
  "eventId": "evt-ivr-no-answer-final-20260522-001",
  "eventType": "business-platform.ivr.ivr-no-answer-final.v1",
  "eventVersion": "1.0",
  "occurredAt": "2026-05-22T10:20:00+07:00",
  "source": "business-platform",
  "correlationId": "corr-ivr-20260522-003",
  "causationId": "ivr-call-attempt-20260522-003",
  "idempotencyKey": "ivr-no-answer-final-order-20260522-001",
  "data": {
    "ivr_call_result_id": "ivr-result-20260522-003",
    "version": "v1",
    "ivr_call_job_id": "ivr-call-job-20260522-003",
    "task_id": "ivr-task-20260522-003",
    "official_order_id": "order-20260522-003",
    "final_result_status": "IVR_NO_ANSWER_FINAL",
    "result_type": "NO_ANSWER_FINAL",
    "is_counted_customer_attempt": true,
    "is_final_for_ivr": true,
    "core_order_handoff_required": true,
    "human_review_required": false,
    "input_signal_only": true,
    "no_direct_order_update": true,
    "no_payment_or_revenue_effect": true
  }
}
